[
  {
    "schema_version": "1.0.0",
    "id": "scut811-p1-q0230",
    "revision": 1,
    "family_id": "scut811-p1-q0230",
    "variant_role": "base",
    "chapter": 5,
    "section": "5.1",
    "blueprint_section": "5.1",
    "knowledge_point_id": "kp-5.1",
    "knowledge_point": "非周期序列与DTFT",
    "type": "mcq",
    "subtype": "concept",
    "importance_811": 4,
    "syllabus": "explicit",
    "can_skip": false,
    "notation_profile": "oppenheim-2e-ct-dt-v1",
    "stem": "DTFT \\(X(e^{j\\omega})\\) 关于 \\(\\omega\\) 的基本周期是多少？",
    "options": [
      {
        "id": "A",
        "content": "它通常不周期",
        "error_tag": "CONFUSE_CT_DT"
      },
      {
        "id": "B",
        "content": "\\(2\\pi\\)",
        "error_tag": null
      },
      {
        "id": "C",
        "content": "\\(\\pi\\)",
        "error_tag": "WRONG_PERIOD"
      },
      {
        "id": "D",
        "content": "序列长度N",
        "error_tag": "WRONG_MOD_N"
      }
    ],
    "correct_option": "B",
    "explanation": "正确：指数核对 \\(\\omega+2\\pi\\) 不变，所以DTFT以 \\(2\\pi\\) 为周期。错项混淆半周期、DTFS模N或CTFT。易错点：任何离散时间序列的DTFT都具有此周期性。",
    "source": {
      "type": "KEY_EXERCISE",
      "reference": "基于重点习题5.8（利用DTFT性质和基本对求逆变换；不是教材第5.8节）的受控短题改写；答案与干扰项待人工复核。",
      "parent_id": null,
      "parent_knowledge_point": null,
      "citations": [
        {
          "source_id": "SCUT811-KEY-EXERCISE-LIST-01",
          "location_text": "第5章重点课后题列表",
          "pdf_page": 4,
          "printed_page": null,
          "section": "第5章",
          "item": "5.8",
          "year": null,
          "original_exam_code": null
        },
        {
          "source_id": "OPPENHEIM-2E-LIU-01",
          "location_text": "习题5.8",
          "pdf_page": 279,
          "printed_page": "256",
          "section": "第5章 离散时间傅里叶变换",
          "item": "5.8",
          "year": null,
          "original_exam_code": null
        }
      ],
      "verification": "needs_manual_check"
    },
    "review": {
      "status": "reviewed",
      "reviewer": "project-owner",
      "reviewed_at": "2026-09-16T00:00:00+08:00",
      "notes": "Phase 1第5章已完成人工内容审核并获准进入正式学习版；来源核验状态保持独立，不据此伪造verified。"
    }
  },
  {
    "schema_version": "1.0.0",
    "id": "scut811-p1-q0231",
    "revision": 1,
    "family_id": "scut811-p1-q0231",
    "variant_role": "base",
    "chapter": 5,
    "section": "5.1",
    "blueprint_section": "5.1",
    "knowledge_point_id": "kp-5.1",
    "knowledge_point": "非周期序列与DTFT",
    "type": "mcq",
    "subtype": "concept",
    "importance_811": 4,
    "syllabus": "explicit",
    "can_skip": false,
    "notation_profile": "oppenheim-2e-ct-dt-v1",
    "stem": "序列绝对可和 \\(\\sum_n|x[n]|<\\infty\\) 对DTFT意味着什么？",
    "options": [
      {
        "id": "A",
        "content": "它说明序列一定周期",
        "error_tag": "WRONG_PERIOD"
      },
      {
        "id": "B",
        "content": "它说明序列能量必为无穷",
        "error_tag": "CONFUSE_ENERGY_POWER"
      },
      {
        "id": "C",
        "content": "它是DTFT一致存在的一个充分条件",
        "error_tag": null
      },
      {
        "id": "D",
        "content": "它是DTFT存在的必要条件",
        "error_tag": "IGNORED_CONVERGENCE_CONDITION"
      }
    ],
    "correct_option": "C",
    "explanation": "正确：绝对可和保证DTFT收敛，但广义意义下还有其他序列。错项把充分条件说成必要或混淆周期、能量。易错点：常数序列需冲激列形式的广义DTFT。",
    "source": {
      "type": "KEY_EXERCISE",
      "reference": "基于重点习题5.9（由虚部、单边性与Parseval恢复序列）的受控短题改写；答案与干扰项待人工复核。",
      "parent_id": null,
      "parent_knowledge_point": null,
      "citations": [
        {
          "source_id": "SCUT811-KEY-EXERCISE-LIST-01",
          "location_text": "第5章重点课后题列表",
          "pdf_page": 4,
          "printed_page": null,
          "section": "第5章",
          "item": "5.9",
          "year": null,
          "original_exam_code": null
        },
        {
          "source_id": "OPPENHEIM-2E-LIU-01",
          "location_text": "习题5.9",
          "pdf_page": 280,
          "printed_page": "257",
          "section": "第5章 离散时间傅里叶变换",
          "item": "5.9",
          "year": null,
          "original_exam_code": null
        }
      ],
      "verification": "needs_manual_check"
    },
    "review": {
      "status": "reviewed",
      "reviewer": "project-owner",
      "reviewed_at": "2026-09-16T00:00:00+08:00",
      "notes": "Phase 1第5章已完成人工内容审核并获准进入正式学习版；来源核验状态保持独立，不据此伪造verified。"
    }
  },
  {
    "schema_version": "1.0.0",
    "id": "scut811-p1-q0232",
    "revision": 1,
    "family_id": "scut811-p1-q0232",
    "variant_role": "base",
    "chapter": 5,
    "section": "5.1",
    "blueprint_section": "5.1",
    "knowledge_point_id": "kp-5.1",
    "knowledge_point": "非周期序列与DTFT",
    "type": "mcq",
    "subtype": "formula",
    "importance_811": 4,
    "syllabus": "explicit",
    "can_skip": false,
    "notation_profile": "oppenheim-2e-ct-dt-v1",
    "stem": "DTFT分析公式是哪一个？",
    "options": [
      {
        "id": "A",
        "content": "\\(X(j\\omega)=\\int x(t)e^{-j\\omega t}dt\\)",
        "error_tag": "CONFUSE_CT_DT"
      },
      {
        "id": "B",
        "content": "\\(X(e^{j\\omega})=\\sum_nx[n]e^{j\\omega n}\\)",
        "error_tag": "SIGN_ERROR"
      },
      {
        "id": "C",
        "content": "\\(X[k]=\\frac1N\\sum_nx[n]e^{-jk\\omega_0n}\\)",
        "error_tag": "CONFUSE_CT_DT"
      },
      {
        "id": "D",
        "content": "\\(X(e^{j\\omega})=\\sum_{n=-\\infty}^{\\infty}x[n]e^{-j\\omega n}\\)",
        "error_tag": null
      }
    ],
    "correct_option": "D",
    "explanation": "正确：DTFT对整数n求和并使用负指数核。错项混入CTFT、写反符号或混入DTFS。易错点：DTFT频率连续但频谱周期。",
    "source": {
      "type": "KEY_EXERCISE",
      "reference": "基于重点习题5.8（利用DTFT性质和基本对求逆变换；不是教材第5.8节）的受控短题改写；答案与干扰项待人工复核。",
      "parent_id": null,
      "parent_knowledge_point": null,
      "citations": [
        {
          "source_id": "SCUT811-KEY-EXERCISE-LIST-01",
          "location_text": "第5章重点课后题列表",
          "pdf_page": 4,
          "printed_page": null,
          "section": "第5章",
          "item": "5.8",
          "year": null,
          "original_exam_code": null
        },
        {
          "source_id": "OPPENHEIM-2E-LIU-01",
          "location_text": "习题5.8",
          "pdf_page": 279,
          "printed_page": "256",
          "section": "第5章 离散时间傅里叶变换",
          "item": "5.8",
          "year": null,
          "original_exam_code": null
        }
      ],
      "verification": "needs_manual_check"
    },
    "review": {
      "status": "reviewed",
      "reviewer": "project-owner",
      "reviewed_at": "2026-09-16T00:00:00+08:00",
      "notes": "Phase 1第5章已完成人工内容审核并获准进入正式学习版；来源核验状态保持独立，不据此伪造verified。"
    }
  },
  {
    "schema_version": "1.0.0",
    "id": "scut811-p1-q0233",
    "revision": 1,
    "family_id": "scut811-p1-q0233",
    "variant_role": "base",
    "chapter": 5,
    "section": "5.1",
    "blueprint_section": "5.1",
    "knowledge_point_id": "kp-5.1",
    "knowledge_point": "非周期序列与DTFT",
    "type": "mcq",
    "subtype": "formula",
    "importance_811": 4,
    "syllabus": "explicit",
    "can_skip": false,
    "notation_profile": "oppenheim-2e-ct-dt-v1",
    "stem": "DTFT合成公式是哪一个？",
    "options": [
      {
        "id": "A",
        "content": "\\(x[n]=\\frac1{2\\pi}\\int_{-\\pi}^{\\pi}X(e^{j\\omega})e^{j\\omega n}d\\omega\\)",
        "error_tag": null
      },
      {
        "id": "B",
        "content": "\\(x[n]=\\int_{-\\infty}^{\\infty}X(e^{j\\omega})e^{-j\\omega n}d\\omega\\)",
        "error_tag": "SIGN_ERROR"
      },
      {
        "id": "C",
        "content": "\\(x[n]=\\frac1N\\sum_kX[k]e^{jk\\omega_0n}\\)",
        "error_tag": "CONFUSE_CT_DT"
      },
      {
        "id": "D",
        "content": "\\(x[n]=2\\pi\\int_{-\\pi}^{\\pi}X(e^{j\\omega})e^{j\\omega n}d\\omega\\)",
        "error_tag": "MISSING_2PI"
      }
    ],
    "correct_option": "A",
    "explanation": "正确：在任意长为 \\(2\\pi\\) 的区间积分，并带 \\(1/2\\pi\\) 与正指数核。错项混淆DTFS或归一化。易错点：积分区间不必固定为 \\([-\\pi,\\pi]\\)，长度正确即可。",
    "source": {
      "type": "KEY_EXERCISE",
      "reference": "基于重点习题5.9（由虚部、单边性与Parseval恢复序列）的受控短题改写；答案与干扰项待人工复核。",
      "parent_id": null,
      "parent_knowledge_point": null,
      "citations": [
        {
          "source_id": "SCUT811-KEY-EXERCISE-LIST-01",
          "location_text": "第5章重点课后题列表",
          "pdf_page": 4,
          "printed_page": null,
          "section": "第5章",
          "item": "5.9",
          "year": null,
          "original_exam_code": null
        },
        {
          "source_id": "OPPENHEIM-2E-LIU-01",
          "location_text": "习题5.9",
          "pdf_page": 280,
          "printed_page": "257",
          "section": "第5章 离散时间傅里叶变换",
          "item": "5.9",
          "year": null,
          "original_exam_code": null
        }
      ],
      "verification": "needs_manual_check"
    },
    "review": {
      "status": "reviewed",
      "reviewer": "project-owner",
      "reviewed_at": "2026-09-16T00:00:00+08:00",
      "notes": "Phase 1第5章已完成人工内容审核并获准进入正式学习版；来源核验状态保持独立，不据此伪造verified。"
    }
  },
  {
    "schema_version": "1.0.0",
    "id": "scut811-p1-q0234",
    "revision": 1,
    "family_id": "scut811-p1-q0234",
    "variant_role": "base",
    "chapter": 5,
    "section": "5.1",
    "blueprint_section": "5.1",
    "knowledge_point_id": "kp-5.1",
    "knowledge_point": "非周期序列与DTFT",
    "type": "mcq",
    "subtype": "formula",
    "importance_811": 4,
    "syllabus": "explicit",
    "can_skip": false,
    "notation_profile": "oppenheim-2e-ct-dt-v1",
    "stem": "对 \\(x[n]=(-a)^n u[n]\\)，\\(|a|<1\\)，其DTFT是什么？",
    "options": [
      {
        "id": "A",
        "content": "\\(1/(1-ae^{-j\\omega})\\)",
        "error_tag": "SIGN_ERROR"
      },
      {
        "id": "B",
        "content": "\\(1/(1+ae^{-j\\omega})\\)",
        "error_tag": null
      },
      {
        "id": "C",
        "content": "\\(1/(1+ae^{j\\omega})\\)",
        "error_tag": "SIGN_ERROR"
      },
      {
        "id": "D",
        "content": "\\(1/(a+e^{-j\\omega})\\)",
        "error_tag": "WRONG_COEFFICIENT_NORMALIZATION"
      }
    ],